id	Author	Quotes	Queries	Key_Words
6a6be77a-491e-4141-acb1-c9e57945cfa0	Les Brown	Too many of us are not living our dreams because we are living our fears.	Why can't I find the one thing I am good at? || It is very risky || what if I fail || what if I lose everything? || I want to live my dreams	fear
e5f44e42-2054-475f-b810-c0307781ff82	Les Brown	Life is a fight for territory and once you stop fighting for what you want, what you don’t want will automatically take over.	I am tired || I am struggling || I feel stuck || I want to give up || I want to quit	fight || tired || struggle || quite
1c30d143-9a3e-4ed9-ad1a-bb61eebe7a31	Les Brown	The greatest revenge is massive success.	How to make people jealous of me? || I feel betrayed || how to take revenge? || People are jealous of me || They hate me || People hurts me	revenge
892fd230-660a-4b0f-b329-57da4c025ed2	Les Brown	It’s necessary to get the losers out of your life if you want to live your dream.	what is a good company? || I want to avoid negative people || People hurts me || I want to stay away from toxic people || I want to live my dream || People say I cant do it || How to be happy? || I feel demotivated	demotivated || negative || hopeless || people
e79f6f84-e13c-4dc0-8669-10424dd3da96	Les Brown	People inspire you, or they drain you. Pick them wisely.	what is a good company? || I want to avoid negative people || People hurts me || I want to stay away from toxic people || I want to live my dream || People say I cant do it || How to be happy? || I feel demotivated	demotivated || negative || hopeless || people
cc8accf6-64af-4ac9-89c2-e1a8c7cd0065	Les Brown	If you set goals and go after them with all the determination you can muster, your gifts will take you places that will amaze you.	I am working hard || I want to accomplish my goals || I want to live an amazing life || I am determined	determination
be1de367-8d82-4eb9-b2b8-4bd4f3d74807	Les Brown	Review your goals twice every day in order to be focused on achieving them.	I lose focus || I lose track of time || I cannot concentrate on my goal, I get lost || How to be focused || I have lots of distractions	focused
47954f6f-6c46-4b1c-aaf0-671827bfc3bc	Les Brown	Align yourself with people you can learn from, people who want more out of life, people who are stretching and searching and seeking some higher ground in life.	My friends waste my time || I waste lot of time with friends || I hangout too much || How to be more curious? || How to be more excited?	motivated || success || people
3e72fe3a-8d78-4f52-8de7-3a10514b605f	Les Brown	The truth that will set men free, is the truth men don’t want to hear.	I admit my mistakes || It is the harsh reality || They think I am a liar || what is the truth? || Is it true?	truth
01ec8a2a-7407-4fab-9735-20d5ee8ddacc	Les Brown	You are the only real obstacle in your path to a fulfilling life.	what is a greatest obstacle between my goals? || What is stopping me? ||I have so many obstacles || I want fulfillment || I have negative thoughts || I have unhealthy thoughts	obstacle
8cf4b69a-f738-4eda-9393-66583add010a	Les Brown	Honour your commitments with integrity.	I can’t keep my commitments || I lie too much	commitments
cdd9ea9a-db26-4761-a557-090a9dd26ba6	Les Brown	Know your gifts and share them.	I want to help people || I feel thankful || I am god gifted	gift
f214efd0-0c83-4704-a4d1-5bd56de4aad5	Les Brown	You must have an emotional connection with your dreams and know why you want to accompalish them. When your why is big enough you will find your how.	I want to achieve my dream || How do I achieve my dream? || How to get motivated?	why || dream
708186fc-97c3-43cb-ab77-fa06b84b9a7a	Les Brown	You must see your goals clearly and specifically before you can set out for them.	I want to do something big || I should get started || I work without goals	
bbf58742-5bbd-49c5-b24a-1b217595eee5	Les Brown	In every day, there are 1,440 minutes. That means we have 1,440 daily opportunities to make a positive impact.	Time is too short || I am running out of time || I want to make positive contributions	time
837d7cfa-9331-49f4-976c-a929715b8b1b	Les Brown	Our ability to handle life’s challenges is a measure of our strength of character.	I lost my loved one || How do I get back up after collapse || I can't do it anymore || Life has knocked me to the ground || I am shattered	strength
197a0664-4350-4e38-85fd-9f2f2244d14b	Les Brown	Your level of belief in yourself will inevitably manifest itself in whatever you do.	I don’t trust myself || I have self-doubt || I always end up doing wrong || I am not good at anything || I don’t believe in myself	belief
60963c25-d442-4e11-8521-05c4f059f9c3	Les Brown	We have to live life with a sense of urgency so not a minute is wasted.	I waste a lot of my time || What should I do to secure my time? || I lose track of the time	time || waste
e0a8bad2-ef4a-4a99-9365-d496a1052428	Les Brown	Life has no limitations except the ones you make.	It is beyond my capacity || I have limits || It is too much for me || I can never do that || It is impossible	limitations
caee7ad5-2ff6-4e5f-ace4-6ac11d718849	Les Brown	Accept responsibility for your life. Know that it is you who will get you where you want to go, no one else.	I need support || No one helps me || Everybody is mean || Because of them I failed || because of it I cant do	responsibility
6ff9d700-37be-4210-b55c-fbecbc643e0a	Les Brown	All of us have made some mistakes in life. All of us have done some things that if we had them to do over again we wouldn’t do it again. That’s what you did then; if you won’t do it today and yet are still blaming yourself, you are picking on an innocent man.	I have a regret || I have a guilt || I have made many mistakes || I need to move on || How to forget the past?	mistakes || regret || guilt
5168d8c2-7b9b-4d83-9709-1ba957deac6c	Les Brown	One of the things that we know about life is that it is always changing. Sometimes you’re up; sometimes you’re down. Sometimes things go real well, and sometimes they don’t. Sometimes you’re happy and sometimes you’re sad. Now that’s that thing called life.	What is life? || tell me about life || I want to keep going	life || changing
e688a389-b201-4eea-8845-19bf47d8663b	Les Brown	During those down moments, that’s where the growth takes place. That’s where the work is.	I am feeling down || I don’t feel like doing anything || I do nothing worthy || I am feeling low	down
75f0edf7-5032-40c9-bf3b-430486e874cd	Les Brown	Anybody can feel good when they have their health, their bills are paid, they have happy relationships, the children are acting normal. Business is successful; anybody could be positive then. Anybody can have a larger vision then. Anybody can have faith under those kinds of circumstances. See, but the real challenge of growth mentally, emotionally, and spiritually comes when you get knocked down.	I don’t feel good || Nothing goes out well || life has knocked me || Life has been messed || Life has been screwed	struggle
f147f0de-e87c-441b-8c0d-3a2dc05bad96	Les Brown	Adversity introduces a man to himself or woman. How you handle it, that’s where the growth takes place.	How to handle adversity? || Adversities has fallen on me || I am facing constant bad luck || I am fighting against odds	adversity
bff7c376-45c9-4458-911f-404edfd8dcb7	Les Brown	Insanity is doing the same thing in the same way expecting a different outcome	I have dome a mistake again || I dont learn from mistakes || I repeat the mistakes	outcome
cb216010-80b1-41ae-bb23-969173148f04	Les Brown	During adversities, ask yourself - Am I going through it or am I growing through it? Am I bigger and better, because of it? Because it’s not going to leave you until you grow through it. Until you handle it with grace, it will stay in your face.	I am stuck || I want to get out of the mess || Problems seem to be never ending	adversity
86f83b30-b448-40e5-ab82-17f24b2dc19b	Les Brown	Life isn’t fair. Life just is. It’s not fair that birds eat worms and they do.	Life isn't fair to me || I have seen terrible things in life || Why only me?	unfair
c9a4e099-436b-48e6-8af0-bf1c17415639	Les Brown	Forgive and grow. You have to let that luggage go. You see your mind is just like the gas service station. You don’t go in there and just start pumping. When you push the lever up it clears the previous bill.	I can’t forget about him || How do I move on? || How to stop thinking of the past? || I have a regret	past || regret
2fd79c16-60d4-46a5-8c95-c2c92a033c4c	Les Brown	It doesn’t matter about what happens to you. What matters is what are you going to do about it?	I failed in exam || Why it happened to me only || A strategy happened to me || I just got into a huge problem || I am in big trouble	matter || strategy || trouble
073e5e83-0363-4749-97da-7c3d87315018	Les Brown	Don’t go around telling people what your story is. Everybody has a story. 80% don’t care and 20% glad it’s you.	I have a story to tell || No one listens to my plight || I want to tell you my story	story || plight
116d8f76-131c-4470-a413-cb87f79b3d9f	Les Brown	Make a declaration to yourself, declare all-out war that you’re going to get out of this rut.	I am trapped || I am stuck|| How to achieve it at any cost? || I will get my self out of this mess || I will save my self || I need a way out	stuck
f289cc0f-c43a-4536-b44d-0051cb5dbf47	Les Brown	I don’t care how much you work on yourself. There are some times when things aren’t going to go right. There are times when anything that can happen will happen. Murphy’s Law will be knocking at your door. Why? I don’t know why that’s called life and you have to deal with it. But it is during those down moments when your character is developed.	I am going through bad times || It is difficult times to deal with || I can't handle the loss || I am going through hardships	hardship
e76231f8-922d-4ea5-8614-609b4c5fdcbf	Les Brown	I suggest to you that if you are facing a challenge, don’t stop. Stay busy. Work your plan. Continue to do those things that you know that work for you after you have evaluated yourself in the situation. Continue to move; stay busy;	My situation is very bad || I have lots of challenges || I am devastated by problems || I want a way out || I am stuck	situation
97b3d5d1-a286-435e-8480-3b3b107c57bf	Les Brown	Help somebody because what you give is what you get. Find somebody that you can help so you can forget about you for a moment. Help others achieve their dreams and you will achieve yours.	I want to forget everything || I want to forget the moment || I feel terrible now || I help people a lot || I want to feel better now || I am not feeling good	
c99e2179-11e5-4585-9bec-a4b3353e108e	Les Brown	Sometimes you have to back up and go within and pray and meditate and recharge your batteries. Go away, clear your head and then come back and look at it from a different vantage point. Don’t operate while you are under the spell of the effect of what’s going on.	I need a break || I am out of my mind || I am not in my senses || I am exhausted of hard work || I need a vocation || I have tried everything || my mind is saturated	break || saturated
a68dc4d4-81f3-4010-9124-9d611e96ae77	Les Brown	Activate the thinker in you. Don’t allow your emotions to control you. We are emotional but you want to begin to discipline your emotion. If you don’t discipline and contain your emotions, they will overwhelm you.	I am emotional || I am too sensitive	emotions
a7e625f2-55ef-4bb9-a204-b377eb5fac08	Les Brown	You have got to make a declaration that this is what you stand for. You’re standing up for your dreams; you’re standing up for peace of mind; you’re standing up for health. You want it and you’re going to go all out to have it.	I deserve better || I want to change my life || I don’t wont to live like this || I want to live a happy life || I want to love myself || I love my self || I don’t take care of myself ||I want to go to gym || I want to recover || I will stand up again || I will show up again || I will lift myself || I will build myself || I will work on myself	declaration || health || peace
580d84d4-eadf-445c-947f-1a4972814eae	Les Brown	If it were easy, everybody would do it. If you do what is easy, your life will be hard. If you do what is hard, your life will be easy.	It is impossible || It looks very difficult || It is very challenging || It is not easy || It is not as easy as you say || If it was that easy || Tell me an easy way	easy
8a41dd4d-2b6a-4136-a411-9881d6e76a10	Les Brown	Expect things to get better for you, because they will. See, life is cyclic. Whatever experience you’re having right now, it has not come to stay; it has come to pass.	Will I ever get out of this mess? || I am going through difficult times || My sufferings seem to have no end || I don’t want to live || When my dark times will be over? || I am waiting for good days to come || When will my good days come? || I am feeling terrible now || Hard time seems to be not passing || I am going through some dark times	hope
5b2b5652-81ba-412e-bf78-26111a979f69	Les Brown	This too shall pass...	Will I ever get out of this mess? || I am going through difficult times || My sufferings seem to have no end || When my dark times will be over? || I am feeling terrible now || Hard time seems to be not passing || I am going through some dark times	sufferings
275ede85-64eb-4166-b2ac-32434d3e5061	Les Brown	People say to me they want to commit suicide. I ask them so you want to come up with a permanent solution to a temporary problem?	I want to commit suicide || I will suicide || I don’t want to live anymore || I am done with my life || What are the ways to commit suicide? || I will kill myself	suicide
3c07a051-b60b-4c32-9c59-c7af9a0941e2	Les Brown	Repeat after me: there’s always a way. Where there’s a will, there’s a way.	There is no way out || I can’t see any clue to solve the problem || How do I get out of this mess? || I don’t know what to do as I am lost || I have no idea how to handle the situation || There is way || There is nothing anyone can do to help me || Things will never get changed || I am hopeless || I feel hopeful || I cant see the way || Give me hopes	will || way
04851ea2-fde7-4de5-b77a-102e2b842bd9	Les Brown	Take full responsibility for your life. Except where you are and take the responsibility of taking yourself where you want to go.	I have so many people to blame || So many reasons for my failure || I am unlucky || Luck is not in my favor	responsibility
57d699d2-c2df-4983-bd39-f0489d977d27	Les Brown	I tell to those you were adopted God took you from the womb of your biological mother and put you in the heart of your foster parent	I was adopted || My parents gave me up for adoption || I dont know my parents	adopted
627ba8b8-c478-4155-a4aa-5771a97babe5	Les Brown	Forgive yourself and learn to love yourself unconditionally	I want to love myself || I love myself || I feel piety on myself || I want to take care of myself || I have been harsh on myself || I have wronged myself || I have done sins || I dont take care of myself	myself || love
2bb854c6-37ca-4d79-b7fc-5a3998c23cbd	Les Brown	Let it go, so you can grow.	How to take revenge? || I can’t forget my past || I want to move on || I have regret || I have guilt || I have mad memories haunting me || I have grudges || I had a bad experience || My past is dark	guilt || regret
6654bfe2-e4a7-473c-a01b-d7697e534783	Les Brown	You can always go beyond anything that you have ever done.	I don’t want to be satisfied || I have limits || That is the maximum I can do || How to know my limits? || I want to challenge my limits	beyond
fbf48c7d-b653-48b2-b00f-e5e680d0b5b5	Les Brown	Life is so beautiful.	Life is boring || how is your life?	
68479663-af35-4ecd-b52a-aa4395b2a89c	Les Brown	Sometimes life will take you to your knees. You must know, however, that pain opens spaces in the heart for joy.	Life is tough	pain
1935328b-25f3-4f13-b8fe-8f324d7677ae	Les Brown	Keep you moving forward and experimenting and readjusting your strategy and your plan of action continuously looking for ways to win	Tell me how to achieve goal || Tell me a way to succeed || How to go about doing things rightly || How to progress? || How to take right decisions? || My plans does not work || All my plans failed	plan
97abdc64-a0f0-43cf-99ad-24fd990ed0c4	Les Brown	Whatever you’ve done up to this point, is a duplication of what you believe subconsciously that you deserve and what’s possible for your life.	I cant do it || I cant achieve anything in life || I think that is not possible for me || I want to achieve it || It is impossible || I want it so much	believe
78f0cd25-2317-472f-9d83-f75fcf56a053	Les Brown	People say if I see it, I will believe it. I say if you believe it, you will see it	I dont believe in miracles || I dont believe in God || I dont belive in magic || I dont belive myself || I have self doubt || I dont believe I can do it	believe
f7215956-0935-4893-9b50-181f878f52b0	Les Brown	Say no matter how bad it is, or how bad it gets, I’m going to make it. I’m going to make it.	it is getting worse	will
7ee08199-838c-4996-ad6c-981808aba012	Les Brown	Repeat after me please. It’s possible. I can have my dream. I can get what I want. I must be creative and never give up.	I am giving up on my dream || I quit || I want to give up || My best is not good enough || I can never get what I want	possible || quite
94e8deca-11d3-410c-bbfa-89fc607ad40b	Les Brown	All of us have some purpose for being here in this universe. You are vessel to something great.	What is my purpose in this life? || Why am I here for? || Am I here for any reason?	
51f22ae4-8a05-4302-a2d8-f8a490e0ab59	Les Brown	What people think about you and the possibilities for your dream is none of your business. That’s their business.	People are cynic about my abilities || People doubt if I will be ever able to make it || People just don’t like anything about me || I have lots of critics || They say I can never do it	people || business
c70ca344-1f61-406b-85ea-5fff240f2744	Les Brown	Every day, as long as you’re breathing, you’ve got a shot at your dream	I am too old to pursue my dream || Life is too short to work hard	
a39c53b1-8961-4820-a3ee-ebb83c00966d	Les Brown	Here’s what I discovered. You will go through things and while you’re going through them, you can’t understand why it’s happening to you. But after you go through it, you will look back and say, ‘Oh, now I understand why I needed that lesson’. That is how life prepares you for bigger and better things.	I prayed a lot || God does not answer my prayers || Why is it happening to me?	
73b44d49-df10-41d3-979b-ab907e45058c	Les Brown	If it’s hard then, do it hard.	What is an easy way to be rich? || How to do less work and be successful? || My journey is hard || My life is hard	hard
e58dfd48-07b3-41ac-82a0-4b60bc6abaf7	Les Brown	In the Far East, they have something that’s called the Chinese bamboo tree. The Chinese bamboo tree takes five years to grow and they go through a tiresome process of growing it. They have to be watered and fertilized every day. Now, the plant doesn’t break through the ground until the fifth year. But once it breaks through the ground, within five weeks, it grows 90 feet tall! That is exactly how your dream will grow! Keep watering your dream. When it breaks through the ground, it will amaze you!	I see no results || I have worked hard but no results || I am thinking to give up || I am working hard but I am not getting the results || I am already working so hard	
7a676ad1-21ef-45c6-9b65-0e724652b279	Les Brown	The harder the battle the sweeter the victory.	It is getting so hard for me || It requires a lot of effort	victory || battle
5cfd578c-8df0-4290-b53d-1e7ac795fc15	Les Brown	It’s necessary we get negative-do-nothing-people out of our lives.	what is a good company? || I want to avoid negative people || People hurts me || I want to stay away from toxic people	people
207866a8-f61c-446d-8256-2f3d4e47720a	Les Brown	Life should be full of action and adventure and yet most people go through life quietly and safely tiptoeing to an early grave.	I want to play safe || How a life should be? || I want to try new things || Life is boring || I feel bored || I am lazy	adventure || safely
e7407755-c342-4912-b3cb-9f7802182885	Les Brown	There is this room for you to come out and live your dream. Don’t allow yourself to be in the bleaches looking at life like a spectator and not being a participant. Find out what it is you want and go after it as if your life depends on it.	What to do in life? || I have to do something in life || I have no control over myself	
b5328c20-a51d-49bb-9a30-a3a71525b3ba	Les Brown	Why is it that people prefer known hells to unknown heavens?	I dont want to change || I want my ex back || I miss my ex || I dont want to end the relationship || My job is very toxic || I dont want to leave this country || I dont want to be deported	unkown || prefer
c6c34095-66f7-4d09-a95d-6867d836f34f	Les Brown	There is a difference between failing and being a failure.	I am a failure || I have failed many times	failure
e5d1b049-7a72-470d-bd91-1874ba517936	Les Brown	Life is all about today.	I hope tomorrow will be better || I am happy today || It was a great day || I keep postponing	today
83e18cd0-a232-4b39-b5e0-aa34d7dd4fe0	Les Brown	He who learns the most earns the most.	why should I learn?	learns || earns
874fc946-e10a-4bce-8a7b-42fc0da1d295	Les Brown	If you are determined, the universe is on your side. The universe will yield to you and life will never be the same again. You have been given something to bring to the universe that was not here before you showed up. I say to you the universe is calling you.	Universe does not favour me || Universe is against me	determined
74629eb2-e254-47c8-90e9-5443b2c1ac8a	Les Brown	Here’s something about life: you can’t get out of it alive. Therefore, live a life full of adventures!	I am scared || I don’t want to risk || I want to play safely || I want to do something new in life || I want to do something different	adventure || live
f3ec88b2-ace8-4a98-956b-61d9333d6c04	Les Brown	If you want a thing bad enough to go out and fight for it, to work day and night for it, to give up your time, your peace and your sleep for it… if all that you dream and scheme is about it, and life seems useless and worthless without it… if you gladly sweat for it and fret for it and plan for it and lose all your terror of the opposition for it… if you simply go after that thing you want with all of your capacity, strength and sagacity, faith, hope and confidence and stern pertinacity… if neither cold, poverty, famine, nor gout, sickness nor pain, of body and brain, can keep you away from the thing that you want… if dogged and grim you beseech and beset it, with the help of God, you will get it!	Will I ever be able to achieve my goal? || I have a dream || I want to accomplish my dream || I want to achieve it || Should I do it?	wish || desire
2b72f430-ab35-4670-a4f3-255395dbe9e8	Neil deGrasse Tyson	I have a personal philosophy in life: If somebody else can do something that I’m doing, they should do it. And what I want to do is find things that would represent a unique contribution to the world — the contribution that only I, and my portfolio of talents, can make happen. Those are my priorities in life.	I want to do something different || What if they steal my idea? || How to be different?	unique
7d2fea3f-4b59-455b-855f-1529f73540e3	Neil deGrasse Tyson	Do you realize that if you fall into a black hole, you will see the entire future of the universe unfold in front of you in a matter of moments and you will emerge into another space-time created by the singularity of the black hole you just fell into?	Tell me my future || Do you know my future?	
830430f8-3f54-4747-8e1a-cf7e367b4b0d	Neil deGrasse Tyson	The Universe is under no obligation to make sense to you.	I cannot understand this || Why did this happen? || Why me? || How is this possible? || This is unbelievable || Does not make sense	sense
bdd55095-ea42-4ff6-a10a-ffa84496bd95	Neil deGrasse Tyson	Recognize that the very molecules that make up your body, the atoms that construct the molecules, are traceable to the crucibles that were once the centers of high mass stars that exploded their chemically rich guts into the galaxy, enriching pristine gas clouds with the chemistry of life. So that we are all connected to each other biologically, to the earth chemically and to the rest of the universe atomically. That’s kinda cool! That makes me smile and I actually feel quite large at the end of that. It’s not that we are better than the universe, we are part of the universe. We are in the universe and the universe is in us.	Who are we? || I have existential crisis || tell me something cool || Are we insignificant in universe?	
99dc2c4f-55be-4842-bbbb-d5d7122c074b	Neil deGrasse Tyson	We are all connected; To each other, biologically. To the earth, chemically. To the rest of the universe atomically.	I miss my family || I miss my boyfriend || I feel connected || I want to feel connected || I want to touch you || you are just a bot || how to meet you?	
e703dbe9-c164-4eb4-b139-ded8dae94782	Neil deGrasse Tyson	We spend the first year of a child's life teaching it to walk and talk and the rest of its life to shut up and sit down. There's something wrong there.	I am a rebel	
fc0518ec-55f5-42ff-8698-72ceed6c40ba	Neil deGrasse Tyson	There’s as many atoms in a single molecule of your DNA as there are stars in the typical galaxy. We are, each of us, a little universe.	I feel empty || I feel very small	
