id	Author	Quotes	Queries	Key_Words
d21d6282-a797-4199-8628-87a1e4e72a28	Neil deGrasse Tyson	I would request that my body in death be buried not cremated, so that the energy content contained within it gets returned to the earth, so that flora and fauna can dine upon it, just as I have dined upon flora and fauna during my lifetime	I will die || what will happen after death?	
9bd01044-f6b0-4515-8b74-73c3f3f0e2ea	Neil deGrasse Tyson	Many people feel small, because they’re small and the Universe is big, but I feel big, because my atoms came from those stars.	I feel small	
bf021fb1-ccd1-4bcd-a64a-a5a9cad4870f	Neil deGrasse Tyson	We are stardust brought to life, then empowered by the universe to figure itself out—and we have only just begun.	What is the purpose of life? || who are we?	
bfc8b2cf-ac03-47ad-b1e3-7d0054073c4b	Neil deGrasse Tyson	Math is the language of the universe. So the more equations you know, the more you can converse with the cosmos.	How to talk to the universe?	
fece1d97-2550-4d3c-b4dc-f825d03d7d14	Neil deGrasse Tyson	Rational thoughts never drive people’s creativity the way emotions do.	how to be creative?	rational || creative
924bc545-c361-4744-96a1-a258f9a59c2e	African Proverb	If there is no enemy within, the enemy outside can do us no harm	I am lazy || I can control myself || I have negative thoughts	enemy
c6927ec9-1483-4f7d-a20b-dcba5bd8d82e	George Bernard Shaw	people that get alone in this life look around for the circumstances that they want and if they can’t find them they make them, they create them.	I am facing the world alone || I feel alone	circumstances
afd96d2e-b41d-4c0b-bf34-96e21438b12c	Abraham Lincoln	Well, good things may come to those who wait but only the things that have been left over by those who hustle	My pace is slow || I am delaying	
0fa23194-1c3f-4baa-b2cf-3847be631ab2	Charles Udall	In life, you will always be faced with a series of God-ordained opportunities brilliantly disguised as problems and challenges	I have so many problems || There are so many challenges || How to avoid problems?	problems || opportunities
bbd98af8-6d16-488b-b7e9-775c90a9741a	The Serenity Prayer	God, grant me the serenity  to accept the things I cannot change,  the courage to change the things I can,  and the wisdom to know the difference.	wisdom || serenity || destiny	
423bf05a-d4b2-4b4b-b66d-8d5de3d3d3c1	Suzzy Kassem	Doubts kill more dreams than failure will ever	What if I fail? || I have self-doubt	doubts
8b3f79d2-92f4-4b8c-b1d3-723bbecb0c16	Dino Ahmetovic	If you are sad about old memories, make new ones	I have a dark past || I want to move on || I had bad memories || I want to forget	memories || sad
fdab72f6-1ac8-4a39-b71c-b40117229323	Penelope Douglas	Acting like you dont care is not letting go	I don’t care || How to let go?	
b643c46c-0a9f-428b-ab98-277a42a9bd0c	Ricky Gelvais	No one else knows what they are doing either	I don’t know what to do?	
ce7a7406-4476-4e85-9fea-7a50d9214685	R.H Sin	You will be perfect for the one who desereves you	He thinks I am not perfect || They think I am not good || she thinks I have faults	
f0951590-a676-4f96-a417-89355a9c9ff6	Gina Lake	Try giving up all the thoughts that make you feel bad, or even just some of them, and see how doing that changes your life. You don't need negative thoughts. All they have ever given you was a false self that suffers. They are all lies	I have negative thoughts || I have unhealthy thoughts || How to stay positive?	thoughts
83197c31-fe9f-439f-8c9b-b85b9173923e	Israelmore Ayivor	Don’t lose yourself in the process of caring for others. Don’t overdo it as if you don’t need any care to give to yourself	I am very nice to people || People use me || People exploit me || They take advantage of me || I can’t say no	myself
9d30ee58-b357-43c0-98c1-67b533e89874	Adam Savage	You have time to fail. You have time to mess up. You have time to try again	I am getting old || I am too old to take risk || I can't afford a failure || Time is running || Life is screwed up	time || mess
de9e4fb5-b4ff-443e-a3b1-bfa51f83f061	Eleanor Roosevelt	The future belongs to those who believe in the beauty of their dreams	I have a dream || I want to have a good future || I want to do it	
5aad8081-fa7b-49cf-9d9e-9e55dd1e2e77	Aristotle	It is during our darkest moments that we must focus to see the light	I have dark times || I am suffering || I am struggling	darkest || light
311177ae-6892-45c0-9c72-734b7d907f3e	Abraham Lincoln	In the end, it's not the years in your life that count. It's the life in your years	I want to enjoy the life || How to enjoy life || I want to be productive	live
5fda6564-a9c1-4443-94df-bf5a88f82427	Helen Keller	Life is either a daring adventure or nothing at all	What is life? || What if I fail? || It is risky to try	adventure
80b01748-3ba3-4c6c-b47d-b2eda1cdb98d	Tony Robbins	The only impossible journey is the one you never begin	It is impossible || I can’t do it	journey || impossible
d6026a70-835a-4ce5-aef7-54225a95fcc2	Albert Einstien	Only a life lived for others is a life worthwhile	How to live a good life?	
2470952a-0cd5-441b-a2b2-fd6c45451c72	John Lennon	Life is what happens when you're busy making other plans	How to live a happy life? || what is life?	life || busy || plans
a016700e-33b5-486a-aa5c-12f32475fdbe	Winston Churchill	Success is walking from failure to failure with no loss of enthusiasm	I am a loser || I am a failure || I have failed many times || I could not make it	enthusiasum || failure || success
02943dce-e85c-4242-91b9-83a685189b55	Seneca	If one does not know to which port one is sailing, no wind is favorable	I don’t know where to go || I don’t know the direction || I am wandering	direction || way
37ebb6a6-59e1-4f12-93cb-4aeacd8392e4	Seneca	Luck is a matter of preparation meeting opportunity	I want to be lucky || I want opportunities || I want to be fortunate || I am unlucky	luck || preparation || opportunity
efdd6747-2e64-4c44-bf74-c163237cb446	Seneca	Time heals what reason cannot	I have a regret || I am suffering || I am shattered || I am ruined || I am heart broken	Heals
4a99dddc-a206-4584-8426-4cba7722e536	Mark Twain	Twenty years from now you will be more disappointed by the things that you didn’t do than by the ones you did do. So throw off the bowlines. Sail away from the safe harbor. Catch the trade winds in your sails. Explore. Dream. Discover	What if I fail? || Should I do it? || I don’t want to do it || Should I try?	explore || dream || discover
0adac8c9-ba26-49f5-b983-9382327e7526	Socrates	Education is the kindling of a flame, not the filling of a vessel	What is the purpose of education?	education
11228867-4606-4708-babe-ff7e8b8a8cea	Unknown	Your are the master of your own fate. You are the captain of your own ship. You design your own future. It will look like just the way you fashion it to look it.	What is my future going to look like?	future || destiny
76862da6-bc73-4b79-99bc-629af0ce2953	Paulo Coelho	Never explain. Your friends won’t need it. And haters won't understand it.	People don’t understand me || They don’t listen to me || No one understands me	
9e750210-387d-4e7a-a1cc-72f29bc026c1	Paulo Coelho	There is only one thing that makes a dream impossible to achieve: the fear of failure.	What if I fail? || I am scared || I am feeling very fearful	fear || impossible
6dc4e078-eb93-458a-ae65-15be007eb75a	Paulo Coelho	You have to take risks. We will only understand the miracle of life fully when we allow the unexpected to happen.	Life is unexpected || It is very risky || I am nervous to take risk	miracle || unexpected || risks
4b4917ee-2829-4c63-a93d-1023b958c1e4	Paulo Coelho	Every blessing ignored becomes a curse	I want opportunities || I want to be lucky || Luck is not favoring me	curse
3a10f785-b9f2-4c50-b662-ef754c65add9	Paulo Coelho	Everybody has a creative potential and from the moment you can express this creative potential, you can start changing the world.	How to know my potential? || How to know my talent? || I feel I don’t have any talent	potential || talent
b900dc67-908a-4a6f-8760-26cbdc73d6ce	Paulo Coelho	Be brave. Take risks. Nothing can substitute experience.	I am scared || what if I fail? || It is risky || I am afraid of failure	brave || risks
73f1d798-ee5a-4f92-a3f1-c3afd33c4078	Paulo Coelho	When you are enthusiastic about what you do, you feel this positive energy. It’s very simple.	I don’t have energy || I don’t feel motivated || How to motivate myself?	energy || enthusiastic
6fe4a6b2-841d-4f84-b9a4-52778e48f5a1	Paulo Coelho	Remember your dreams and fight for them. You must know what you want from life.	I have a dream || I want to accomplish my dream || My dreams are shattered	
c9b651ce-d1c5-46b3-9c93-26df0840d5e7	Paulo Coelho	When you want something, all the universe conspires in helping you to achieve it.	I want to achieve my dream || I hope it works || it seems difficult	wish
7c58dbc0-2a77-4d2e-9b38-78c938b40f5d	Paulo Coelho	You drown not by falling into a river, but by staying submerged in it.	I am stuck	
214ba2be-dfb8-4f82-b07d-6023c91f740a	Paulo Coelho	Tell your heart that the fear of suffering is worse than the suffering itself. And no heart has ever suffered when it goes in search of its dream.	My dream is difficult to achieve || Want I want is impossible || It looks hard || What if I fail?	dream || suffer
464861db-89ac-4007-b8c8-4a28780fb6e3	Paulo Coelho	The more in harmony with yourself you are, the more joyful you are and the more faithful you are. Faith is not to disconnect you from reality – it connects you to reality.	God is not reality || Religion is not reality	faith
8d32b502-b9d6-400b-90a9-377a7d12bc1a	Paulo Coelho	You can become blind by seeing each day as a similar one. Each day is a different one, each day brings a miracle of its own. It’s just a matter of paying attention to this miracle.	Life is so boring || Each day looks to similar	day || miracle
2a11f768-228a-482d-bfed-cf4ae78e0bd0	Paulo Coelho	When we strive to become better than we are, everything around us becomes better too.	I want to change myself || I want to change others || I want to change the world	better
42337f63-2b3f-4b0d-a8d7-0f84db96fc05	Paulo Coelho	Life has a way of testing a person’s will, either by having nothing happen at all or by having everything happen at once.	Is god testing me? || why all things are happening to me? || why only me?	testing
2f794b0d-99c5-4ba7-a78f-7742b90fad1f	Paulo Coelho	One day you will wake up and there won’t be any more time to do the things you’ve always wanted. Do it now.	I have work to do but I am lazy || I want to do many things || I am lazy about my dream	time
271c442c-b2a5-404e-9580-a6a50102e03b	Paulo Coelho	The secret of life is to fall seven times and to get up eight times.	I have failed so many times || I am a loser || I am shattered	quit
2e8dad04-ef69-4d9e-8b76-1084c497808d	Paulo Coelho	Don’t waste your time with explanations, people only hear what they want to hear.	I tried so hard to explain myself || I tell but they don't understand me || People don’t listen to me	hear
bc9376f0-2110-4243-9fb1-1adf16d7f2f9	Paulo Coelho	Don’t give in to your fears. If you do, you won’t be able to talk to your heart.	What if I fail? || I am scared || I am feeling very fearful	fears
f319a229-4c9a-4f6a-a2ea-d99fbe938dab	Paulo Coelho	When you repeat a mistake, it is not a mistake anymore: it is a decision.	I do same mistake again || I repeat mistakes || I don’t learn from the mistakes	mistake || repeat
010156af-858a-4dca-819c-db47fed19c08	Paulo Coelho	People are capable at any time in their lives, of doing what they dream of.	I think I am too old for this || I am getting old || I want to be young	capable || limits
d832c572-96f4-4d36-97e8-87974e7b562c	Paulo Coelho	Disappointment, defeat, and despair are the tools God uses to show us the way	I am feeling lost || I don’t see the way || Which direction to go? || I am wandering	
336b320c-48bc-4253-84a8-36429bfd493c	Paulo Coelho	The simple things are also the most extraordinary things, and only the wise can see them.	I want to do something extraordinary	extraordinary || simple
4042c2b1-b5e4-4afc-a480-472eb2fef5e8	Paulo Coelho	I can choose either to be a victim of the world or an adventurer in search of treasure. It’s all a question of how I view my life.	Life is tough || world is hard || time is tough on me || I have lost everything || I have failed || I could not make it	view || adventurer || victim
3d3dc8fa-7e07-42eb-9743-781329557432	Paulo Coelho	People never learn anything by being told, they have to find out for themselves.	Teach me something new || I want to learn from you	teach
825d1299-8dfe-4c76-abe5-4dc99db2f972	Paulo Coelho	You are what you believe yourself to be.	I don’t believe in myself || I am worthless || I have self-doubt	
f0bb5779-fef3-44ca-9383-fa012dbef0f0	Paulo Coelho	What is a teacher? I’ll tell you: it isn’t someone who teaches something, but someone who inspires the student to give of her best in order to discover what she already knows.	You are a good teacher	teacher
f2ff7544-380f-4d36-83b2-52997fdd28f0	Paulo Coelho	When someone leaves, it’s because someone else is about to arrive.	I lost my mother || My father died || I lost my family member	died
af882fb5-f7a1-4136-ada4-fa92c7abe18f	Paulo Coelho	Life is too short for me to allow myself the luxury of living it so badly.	Life is short || I am wasting time	short || live
9d41ea77-feb5-4384-a738-d7c749a926f2	Paulo Coelho	There are moments when troubles enter our lives and we can do nothing to avoid them. But they are there for a reason. Only when we have overcome them will we understand why they were there.	I am in trouble	troubles
2342958e-a736-4a6c-bd58-d8ac4ac58668	Paulo Coelho	No one loses anyone, because no one owns anyone. That is the true experience of freedom: having the most important thing in the world without owning it.	My wife left me || I got divorced || My boyfriend dumped me || I lost the love of my life ||	divorced
f3f7f426-1dc2-434c-a628-cec83e3c611c	Paulo Coelho	I don’t live in either my past or my future. I’m interested only in the present. If you can concentrate always on the present, you’ll be a happy man. Life will be a party for you, a grand festival, because life is the moment we’re living now.	I want to live in present || I want to enjoy the movement || I am worried	present || past
2d020a44-4b16-4adb-947e-37b8a876b0f8	Paulo Coelho	If you’re brave enough to say goodbye, life will reward you with a new hello.	My wife left me || I got divorced || My boyfriend dumped me || I lost the love of my life || My friend moved away || I don't want to leave my city || I am moving to a new place || I had a break-up	goodbye || divorce
415b5c6c-4ebb-4107-803a-b492b66ba0a1	Paulo Coelho	All you have to do is pay attention: lessons always arrive when you are ready.	I dint learn any lesson || I dint learn anything	ready || attention
7998bb54-6f8a-41bf-badf-06da9d6c961d	Paulo Coelho	Happiness is something that multiplies when it is divided.	How can I be happy? || How to be more happy in life? || What is the secret to happiness	happiness
883e1fb8-8201-475c-adca-c228236229a9	Paulo Coelho	Blessed are those who do not fear solitude, who are not afraid of their own company, who are not always desperately looking for something to do, something to amuse themselves with, something to judge.	I feel so lonely || I am alone	
bf325a15-47d3-4dfc-b930-01d888d71964	Paulo Coelho	Don’t allow your mind to tell your heart what to do. The mind gives up easily.	I want to quit || I want to dive up || I will not give up || I can’t make my mind	mind
ad778f6f-a863-4be2-b6df-60eb15c49575	Paulo Coelho	Miracles only happen if you believe in miracles.	I need a sign || Show me a miracle || It is not possible || Should I try?	miracles || believe
a09e567c-5963-4741-9f6f-123db3dcaa86	Paulo Coelho	Fortunate are those who take the first steps.	I want to be fortunate || I want to be lucky	fortunate
d1a58b86-c4b1-4e99-9293-9570497a1c04	Paulo Coelho	Do something instead of killing time. Because time is killing you.	What should I do right now? || How should I spend today? || I am wasting time	time
b427d855-3be8-4791-a877-64ed1a930709	Paulo Coelho	A life without cause is a life without effect.	How to live a good life? || I am feeling aimless	cause
c2ea1cf6-01f8-4603-ab72-d761dfa6b082	Paulo Coelho	If you think adventure is dangerous, try routine: it is lethal.	I want to enjoy life || I want to take risk || I want to do something new	adventure
eee1bb2a-2e6b-4bbb-aea6-43a3ecaffe33	Paulo Coelho	Close some doors today, not because of pride, incapacity or arrogance, but simply because they lead you nowhere.	I am in a toxic relationship || I hate my marriage || I hate my job	divorce || toxic
6c8a5c63-032c-4886-93e3-8caaf4963e47	Paulo Coelho	Joy is sometimes a blessing, but it is often a conquest.	I want to enjoy	joy
ef0d4f20-11a5-4afa-b64f-c74086130370	Paulo Coelho	Never give up. When your heart becomes tired, just walk with your legs – but move on.	I want to quit || I want to give up || I will never give up	quit
88ed4a8b-6027-48ec-88b0-5725fa0be5cb	Paulo Coelho	It is possible to avoid pain? Yes, but you’ll never learn anything. Is it possible to know something without ever having experiencing it? Yes, but it will never truly be part of you.	I don’t want this pain || I want suffering to end || I am heart broken	pain
c15325a6-fb52-4c1e-b78a-b5b0eeff9e8d	Paulo Coelho	The secret is here in the present. If you pay attention to the present, you can improve upon it. And, if you improve on the present, what comes later will also be better.	I am worried about the future || My future is dark	present
4947ff3d-df43-45a7-ac18-7929c585b234	Paulo Coelho	What hurts us is what heals us.	I am hurt || I am sad || I am heartbroken || I am devastated	heals || hurts
d8355129-70af-4acf-b508-09d72c97183d	Paulo Coelho	There is only one way to learn. It’s through action.	I want to learn || How to learn?	action || learn
4d13280e-e702-4d7f-8206-ae2317a634ce	Paulo Coelho	Whenever you want to achieve something, keep your eyes open, concentrate and make sure you know exactly what it is you want. No one can hit their target with their eyes closed.	I want to be focused || I don’t know what I have to do	focus || way
ec7f5fa9-5283-4b0d-9691-5e35d6d97230	Paulo Coelho	Haters are confused admirers who can’t understand why everybody else likes you.	They all hate me || I have so many haters || They are jealous	haters
c56f907f-e010-4cee-a1e1-6fac648d07f7	Paulo Coelho	Go for the impossible. I always tried to find my own limits. So far I did not find them, so my universe is in constant expansion.	It is impossible || I have a limit || It is beyond my capacity	impossible || limits
d3970f48-13f5-4993-b28c-bcaadc660685	Paulo Coelho	Timidity puts obstacles in your path, boldness eliminates them.	I am afraid || what if I fail || I am fearing	timidity || obstacles || bold
6d8eb1f7-2071-4c86-9422-b957e1d66e1e	Paulo Coelho	‘Someday’, ‘maybe’ and ‘if’ are very dangerous words that must be avoided.”	maybe I can do it || Someday I will do it ||	someday || maybe
97824120-65c8-4fca-82c8-9140a8929cca	Paulo Coelho	Don’t listen to the malicious comments of those friends who, never taking any risks themselves, can only see other people’s failures.	My friends are jealous of me || they want to tear me apart || they can’t see by succeeding	jealous
e6e4d348-bb36-4a81-ad45-c74cf55699ea	Paulo Coelho	All battles in life serve to teach us something, even the battles we lose.	I have lost it || I have failed || I could not succeed || I tried || I could not make it	lose || battle
c24cf833-0ac3-44e6-9158-e09a4b2630d1	Paulo Coelho	Those who never take risks can only see other people’s failures.	I have haters || I have critics || People talk bad about me	haters || jealous
f51c8d0c-77ed-4a48-ae11-6a8510bdb168	Paulo Coelho	The most important experiences we can have are those that take us to the very limit. That is the only way we learn, because it requires all our courage.	I feel like I am standing at the edge of a cliff || I cannot take this anymore	limit
12af2d7f-36e4-46b9-a1aa-f90cb8993b53	Paulo Coelho	The world lies in the hands of those who have the courage to dream and who take the risk of living out their dreams – each according to his or her own talent.	I have a dream || I want to accomplish my dream || My dreams are shattered	dream || courage || risk
27ea1c09-2d50-41e0-9c2b-125ec3b39a3d	Paulo Coelho	It is always important to know when something has reached its end. Closing circles, shutting doors, finishing chapters, it doesn’t matter what we call it; what matters is to leave in the past those moments in life that are over.	I went through a divorce || My girlfriend dumped me || I cannot get over my break-up	past
970a4535-abed-460d-81d5-cc583f6c799b	Paulo Coelho	Tragedy always brings about radical change in our lives, a change that is associated with the same principle: loss. When faced by any loss, there’s no point in trying to recover what has been; it’s best to take advantage of the large space that opens up before us and fill it with something new.	I went through a divorce || My boyfriend friend dumped me || I cannot get over my break-up || I got fired from my job || I lost my job || I am terminally ill || I had an accident	tragedy || loss
60a7c53c-9210-4b5a-b636-248ef0af1034	Paulo Coelho	It’s what you do in the present that will redeem the past and thereby change the future.	I want to live in present || I want to move on || I want to leave the past	present || future
301f90b1-09a7-4b5f-9033-42fab149f3a8	Robert Kiyosaki	In the real world, the smartest people are people who make mistakes and learn. In school, the smartest people don’t make mistakes	I am not perfect || how to avoid mistakes || no room for mistakes	mistakes
4d60632f-241e-41fe-89cb-2247882719e8	Robert Kiyosaki	It’s not what you say out of your mouth that determines your life,it’s what you whisper to yourself that has the most power!	what my inner voice says || should I tell my plans? || I will do it!	whisper || words
f135a683-d673-4e89-87f9-3e67a8622b94	Robert Kiyosaki	The most successful people in life are the ones who ask questions. They’re always learning. They’re always growing. They’re always pushing	I have a question || I need to ask	successful || learning || growing
b1a441ad-6e98-4f23-8ca9-43da36672a50	Robert Kiyosaki	Don’t be addicted to money. Work to learn. don’t work for money. Work for knowledge	Money or knowledge? || learning or earning?	money || knowledge
83cb9752-bf54-4f07-9b3c-17a25c17d58c	Robert Kiyosaki	It’s easier to stand on the sidelines, criticize, and say why you shouldn’t do something. The sidelines are crowded. Get in the game	How to deal with haters? || People often criticize me	haters || criticize
e419b642-396f-406e-942f-f4a4a4c82a24	Robert Kiyosaki	The trouble with school is they give you the answer, then they give you the exam. That’s not life	I am bad in academia || can I learn from academia?	school
d746495e-83ca-47bc-891b-2ff9ee0e9125	Robert Kiyosaki	Complaining about your current position in life is worthless. Have a spine and do something about it instead	I am not happy || I regret || Things are not going well || life is unhappy	complaining || position
47e067bb-666b-4bfb-877e-5b136697e647	Robert Kiyosaki	The fear of being different prevents most people from seeking new ways to solve their problems	I am very different || My all friends do like that ||	fear || different
2f092c19-179d-491e-bdfc-67d8c4a17ce9	Robert Kiyosaki	Winners are not afraid of losing. But losers are. Failure is part of the process of success. People who avoid failure also avoid success	I am a failure || I am afraid of losing || what if I don’t succeed?	failure || losing || fear
81251a8b-0687-4b25-9151-a24dbb4b3c79	Robert Kiyosaki	Successful people ask questions. They seek new teachers. They’re always learning.	I have a question || I need to ask || I want to learn || I want to know || I am curious	questions || learning
d174b92d-0405-4caa-8bfe-c1fc7daed5bf	Robert Kiyosaki	If you want to be rich, you need to develop your vision. You must be standing on the edge of time gazing into the future.	How to have vision? || how to be rich?	rich || vision
d3c6f40b-b456-4fb4-b33e-6a5a36f7ad71	Robert Kiyosaki	If you’re still doing what mommy and daddy said for you to do (go to school, get a job, and save money), you’re losing	My parents want me to do that || it is dream of my parents to go to school	school || parents
58334db9-fc76-4f58-a28b-8de4466638b7	Robert Kiyosaki	The most life destroying word of all is the word tomorrow.	I will do it tomorrow || I am procrastinating too much || I hope tomorrow will be better	tomorrow
3546d2fa-8993-4379-a938-84cb6dd1b8af	Robert Kiyosaki	The size of your success is measured by the strength of your desire; the size of your dream; and how you handle disappointment along the way	I am disappointed by failure || I have a big dream	dream || desire || tomorrow
5bbffb7d-44fd-4b22-9c42-29e3c25d866d	Robert Kiyosaki	I’d rather welcome change than cling to the past.	I cannot get out of the past || I want to look ahead || I have so much regret || I can’t forget || I want to move on	change
914d0afc-4e1f-4711-b046-27827c96ce6f	Robert Kiyosaki	Hoping drains your energy. Action creates energy	I have low energy || How to increase energy level? || I am just hoping	hoping || energy || action
3494b3a0-6e37-482d-80c7-32034066a0c0	Robert Kiyosaki	The more a person seeks security, the more that person gives up control over his life	I want security || I feel insecure || I don’t have control over life	security
